place_id,place_name,review_id_hash,rating,review_text,published_at,published_at_date,response_from_owner_text,response_from_owner_ago,response_from_owner_date,review_likes_count,total_number_of_reviews_by_reviewer,total_number_of_photos_by_reviewer,is_local_guide,review_translated_text,response_from_owner_translated_text
ChIJPxLbKTO35zsRFzyVYjIACog,Tim Hortons,8948cde6b9993d5d00022287fefa9a97,1,Very untrained professional are hired to make the food and beverages here. Extremely Bad experience.,3 days ago,2024-02-14 14:03:06.161700,"Hi Vikash, were sorry to hear about your experience. Please provide us with your contact number at telltims@timhortonsindia.com, along with your feedback. Our team is here to ensure your next visit is exceptional!",3 days ago,2024-02-14 14:03:06.161700,0,2,,False,,
ChIJPxLbKTO35zsRFzyVYjIACog,Tim Hortons,e7d427244a7b6330a19ab0578805ba08,5,,4 days ago,2024-02-13 14:03:06.165727,"Hey there, a million thanks for your fantastic 5-star rating!   Your support brightens our day!",4 days ago,2024-02-13 14:03:06.165727,0,8,,False,,
ChIJPxLbKTO35zsRFzyVYjIACog,Tim Hortons,07166a1af96fcfdc23895c8f6e3f24f1,4,,4 days ago,2024-02-13 14:03:06.168728,"Hey Pranjali, were thrilled to see your rating. It means a lot to us. Looking forward to serving you again soon!",4 days ago,2024-02-13 14:03:06.168728,0,53,28,True,,
ChIJPxLbKTO35zsRFzyVYjIACog,Tim Hortons,00ce0ed35c3001492ba9df661f2dce4d,5,Awesome,4 days ago,2024-02-13 14:03:06.970089,"Hi Dev, were over the moon. Thank you for your support, and we look forward to exceeding your expectations on your next visit!",4 days ago,2024-02-13 14:03:06.970089,0,1,,False,,
ChIJPxLbKTO35zsRFzyVYjIACog,Tim Hortons,acd9b746ccd2565c551c53415405a3f4,5,Good place and ambience,4 days ago,2024-02-13 14:03:06.977083,"Hey Monica, were thrilled to have your support! Looking forward to surpassing your expectations during your next visit.",4 days ago,2024-02-13 14:03:06.977083,0,1,17,False,,
ChIJPxLbKTO35zsRFzyVYjIACog,Tim Hortons,2c967160ebd144bdabede81b401802d1,5,Good place,5 days ago,2024-02-12 14:03:06.982093,Hi Vijay. your positive feedback brightens our day! Were looking forward to the pleasure of exceeding your expectations on your next visit.,5 days ago,2024-02-12 14:03:06.982093,0,2,,False,,
ChIJPxLbKTO35zsRFzyVYjIACog,Tim Hortons,f6a74f0e6bdb3d318365ecea7f731d0b,5,"Nice food, coffee and friendlt staff",5 days ago,2024-02-12 14:03:06.989083,"Hey Badar, your positive feedback brightens our day! Were looking forward to the pleasure of exceeding your expectations on your next visit.",5 days ago,2024-02-12 14:03:06.989083,0,6,,False,,
ChIJPxLbKTO35zsRFzyVYjIACog,Tim Hortons,1b752a5eb443102c2bcae5d065b5b3bd,5,,5 days ago,2024-02-12 14:03:06.995084,"hey Parvej, were thrilled to have your support! Looking forward to surpassing your expectations during your next visit.",5 days ago,2024-02-12 14:03:06.995084,0,3,12,False,,
ChIJPxLbKTO35zsRFzyVYjIACog,Tim Hortons,c590808255e1da46078ae433f5298987,5,Amazing experience,5 days ago,2024-02-12 14:03:07.002083,"Hey Ram, a perfect 5-star rating! Thank you for your unwavering support. Were dedicated to keeping up the great work to make every visit special for you.",5 days ago,2024-02-12 14:03:07.002083,0,1,,False,,
ChIJPxLbKTO35zsRFzyVYjIACog,Tim Hortons,f158b079c14fe1612497e847a1d5f8a2,4,Prompt service and Manager was very helpful,5 days ago,2024-02-12 14:03:07.007082,"Hey there, were thrilled by your positive feedback! Your support means the world to us, and we cant wait to welcome you back for an even more delightful experience.",5 days ago,2024-02-12 14:03:07.007082,0,1,,False,,
ChIJPxLbKTO35zsRFzyVYjIACog,Tim Hortons,cb8364e24a32268169505127da40e1e6,5,Coffee is fantastic,5 days ago,2024-02-12 14:03:07.013082,"Hey Vishal, your happiness is our top priority! We appreciate your support and are eager to impress you even more on your next visit.",5 days ago,2024-02-12 14:03:07.013082,0,1,,False,,
ChIJPxLbKTO35zsRFzyVYjIACog,Tim Hortons,27be8ad376b06663885e2b45e64b0876,5,Fabulous ...loved the place,5 days ago,2024-02-12 14:03:07.017082,"Hi Sheju, were thrilled to have your support! Looking forward to surpassing your expectations during your next visit.",5 days ago,2024-02-12 14:03:07.017082,0,4,,False,,
ChIJPxLbKTO35zsRFzyVYjIACog,Tim Hortons,b2b7ec24b84a2d68791828b98e86d3e6,5,Nice place and ambience,5 days ago,2024-02-12 14:03:07.022117,"Hey Sonu, were thrilled by your positive feedback! Your support means the world to us, and we cant wait to welcome you back for an even more delightful experience.",5 days ago,2024-02-12 14:03:07.022117,0,2,,False,,
ChIJPxLbKTO35zsRFzyVYjIACog,Tim Hortons,ef0d9e2785709b496381922a1b75b90f,5,Had a yummy breakfast here..,5 days ago,2024-02-12 14:03:07.895343,"Hey Akram, youve made our day with your 5-star rating! Were committed to maintaining this level of excellence for your next visit. See you again soon for more memorable moments!",5 days ago,2024-02-12 14:03:07.895343,0,1,1,False,,
ChIJPxLbKTO35zsRFzyVYjIACog,Tim Hortons,cd1c373a4c68a0708a85f00a0599c3a3,5,,5 days ago,2024-02-12 14:03:07.899340,"Hey Arnav, a million thanks for your 5-star rating!",5 days ago,2024-02-12 14:03:07.899340,0,2,66,True,,
ChIJPxLbKTO35zsRFzyVYjIACog,Tim Hortons,5bf1d1af0fc0788ae1d3d4000d912a6c,4,"Tim Hortons offers an enticing array of coffee and food options that are sure to please any palate. From rich brews to flavorful snacks, theres something for everyone to enjoy. While the staff is generally good, the self-service setup may not be to everyones liking, detracting slightly from the overall experience. However, a more pressing concern is the presence of stray dogs within the premises. This poses a significant safety risk, especially for children. Instances of attacks on kids by these dogs have been reported, highlighting the urgent need for the establishment to address this issue and ensure the safety of all patrons. Despite these concerns, Tim Hortons remains a popular destination, though improvements in safety measures are crucial for a truly enjoyable experience.",5 days ago,2024-02-12 14:03:07.903344,"Hey Uwais, thank you for providing your feedback. Weve duly noted your comments and will ensure they are conveyed to the relevant team.",5 days ago,2024-02-12 14:03:07.903344,0,54,4333,True,,
ChIJPxLbKTO35zsRFzyVYjIACog,Tim Hortons,27417cf5d402f2ec6f56e9122964d192,1,"Pathetic. Nothing available right now. No sandwich, no tim bits, no chicken wrap, no chicken tikka croissant available at 7pm on a Sunday. Last time sandwich wasnt available on a Saturday.",5 days ago,2024-02-12 14:03:07.907343,"Hey Subhamoy, were committed to improving your experience. Kindly share your contact number at telltims@timhortonsindia.com, along with your feedback, so we can address any issues youve encountered. Thank you for helping us get better!",5 days ago,2024-02-12 14:03:07.907343,0,2,,False,,
ChIJPxLbKTO35zsRFzyVYjIACog,Tim Hortons,b3979a6c8e28b33b0959a9d87cc16f78,5,Lovely coffee,5 days ago,2024-02-12 14:03:07.910343,"Hey there, youve made our day with your 5-star rating! Were committed to maintaining this level of excellence for your next visit. See you again soon for more memorable moments!",5 days ago,2024-02-12 14:03:07.910343,0,2,,False,,
ChIJPxLbKTO35zsRFzyVYjIACog,Tim Hortons,0f4565417d5af5fb50d5d9b53d040e62,5,,6 days ago,2024-02-11 14:03:07.914345,"Hi Qasim, thank you for the fantastic 5-star rating!   Your support means the world to us!",5 days ago,2024-02-12 14:03:07.914345,0,1,1,False,,
ChIJPxLbKTO35zsRFzyVYjIACog,Tim Hortons,96bbd1477af9b342576372a225643fd5,5,,6 days ago,2024-02-11 14:03:07.917345,,,,0,,,,,
ChIJPxLbKTO35zsRFzyVYjIACog,Tim Hortons,2d4c92b8b300aa94beaef19a8bd9962e,5,Good coffee   loved the place,6 days ago,2024-02-11 14:03:07.920343,"Hey Wahid, youve made our day with your 5-star rating! Were committed to maintaining this level of excellence for your next visit. See you again soon for more memorable moments!",5 days ago,2024-02-12 14:03:07.920343,0,1,,False,,
ChIJPxLbKTO35zsRFzyVYjIACog,Tim Hortons,e4ca03c136439928d998d3dde8813958,5,Good service and nice staff ...loved it,6 days ago,2024-02-11 14:03:07.924340,,,,0,1,,False,,
ChIJPxLbKTO35zsRFzyVYjIACog,Tim Hortons,b2854fdbcf2aba25d61723b51610fe13,5,New favourite place!,6 days ago,2024-02-11 14:03:07.927342,"Hey Rajesh, a huge virtual high-five for your 5-star rating! Your satisfaction is what drives our passion. We eagerly waiting for your return for yet another 5-star experience!",5 days ago,2024-02-12 14:03:07.927342,0,2,,False,,
ChIJPxLbKTO35zsRFzyVYjIACog,Tim Hortons,c7e98e73dfe29b25a364c1516c6636b2,5,,6 days ago,2024-02-11 14:03:08.668994,"Hey Shailesh, a perfect 5-star rating! Thank you for your unwavering support. Were dedicated to keeping up the great work to make every visit special for you.",5 days ago,2024-02-12 14:03:08.668994,0,,,,,
ChIJPxLbKTO35zsRFzyVYjIACog,Tim Hortons,4f37e675f19c9854362185064b626a4e,5,Had a fab time here,6 days ago,2024-02-11 14:03:08.672994,"Hi Jigar, your rating motivates us to continue delivering top-notch experiences. We cant wait to serve you again soon.",5 days ago,2024-02-12 14:03:08.672994,0,2,,False,,
ChIJPxLbKTO35zsRFzyVYjIACog,Tim Hortons,932acb93152ebcfb8b45cfb40b670d5d,5,,6 days ago,2024-02-11 14:03:08.676993,"Hey Ranjan, youve made our day with your 5-star rating! Were committed to maintaining this level of excellence for your next visit. See you again soon for more memorable moments!",5 days ago,2024-02-12 14:03:08.676993,0,2,,False,,
ChIJPxLbKTO35zsRFzyVYjIACog,Tim Hortons,c624dd0738bd1fa43bf19855a50a176e,5,,6 days ago,2024-02-11 14:03:08.679993,"Hey Mehedi, thank you for the fantastic 5-star rating!   Your support means the world to us!",5 days ago,2024-02-12 14:03:08.679993,0,3,21,True,,
ChIJPxLbKTO35zsRFzyVYjIACog,Tim Hortons,7c348089486fe85e5b7f139c1a24300b,5,Most awaited Tim Hortons coffee...finally enjoyed to the core....nice place to visit with friends and loved ones....Loved biscoff cold coffee....Dougnuts were yummy too,6 days ago,2024-02-11 14:03:08.682996,"Hi Amrita,  your happiness is our top priority! We appreciate your support and are eager to impress you even more on your next visit.",5 days ago,2024-02-12 14:03:08.682996,0,2,,False,,
ChIJPxLbKTO35zsRFzyVYjIACog,Tim Hortons,750fa1f6733b1c65cb78c5aea16a18bf,5,Had a Wonderful time here...highly recommended to visit for their amazing french vanilla,6 days ago,2024-02-11 14:03:08.687994,"Hey Suraj, were thrilled by your positive feedback! Your support means the world to us, and we cant wait to welcome you back for an even more delightful experience.",6 days ago,2024-02-11 14:03:08.687994,0,1,,False,,
ChIJPxLbKTO35zsRFzyVYjIACog,Tim Hortons,300539f5097f8ae41dbe5c5e0e71e673,5,Friendly service...loved the placee,a week ago,2024-02-10 14:03:08.690961,"Hey Abdul, your positive feedback brightens our day! Were looking forward to the pleasure of exceeding your expectations on your next visit.",a week ago,2024-02-10 14:03:08.690961,1,1,1,False,,
ChIJPxLbKTO35zsRFzyVYjIACog,Tim Hortons,d123656061ecd5695a7156779659ab96,5,Wonderful experience at lokhandwala,a week ago,2024-02-10 14:03:08.694997,"Hi Avdhesh, your happiness is our top priority! We appreciate your support and are eager to impress you even more on your next visit.",a week ago,2024-02-10 14:03:08.694997,1,1,1,False,,
ChIJPxLbKTO35zsRFzyVYjIACog,Tim Hortons,42d9e610b3a3453ef0a102a9adbf44fb,5,,a week ago,2024-02-10 14:03:08.698996,"Hi Ayush, thanks a lot for your rating! We cant wait to welcome you back for another fantastic experience. Until then, take care!",a week ago,2024-02-10 14:03:08.698996,0,,,,,
ChIJPxLbKTO35zsRFzyVYjIACog,Tim Hortons,3b6046420e66c3e2a9f9c8a6a26248bc,5,Amazing coffee....very nice staff,a week ago,2024-02-10 14:03:08.702993,"Hi Mr. Wahid, your positive feedback brightens our day! Were looking forward to the pleasure of exceeding your expectations on your next visit.",a week ago,2024-02-10 14:03:08.702993,0,1,,False,,
ChIJPxLbKTO35zsRFzyVYjIACog,Tim Hortons,cc30a6a5f513824a8e29c76e9254f9b6,5,When I was visited the store everything was awesome i enjoyed there,a week ago,2024-02-10 14:03:09.581919,"Hi Parmesh, ensuring your satisfaction is our top priority! We cant wait to have you back for another exceptional experience.",a week ago,2024-02-10 14:03:09.581919,0,2,,False,,
ChIJPxLbKTO35zsRFzyVYjIACog,Tim Hortons,71af01d3738915adb94109d1def26ed5,5,,a week ago,2024-02-10 14:03:09.585919,"Hi Satyam, we appreciate your generous 5-star rating!",a week ago,2024-02-10 14:03:09.585919,0,,,,,
ChIJPxLbKTO35zsRFzyVYjIACog,Tim Hortons,c26fffae536c9e63fd839d79d2370532,5,Had a good time,a week ago,2024-02-10 14:03:09.589916,"Hi Pramod, your happiness is our top priority! We appreciate your support and are eager to impress you even more on your next visit.",a week ago,2024-02-10 14:03:09.589916,0,1,,False,,
ChIJPxLbKTO35zsRFzyVYjIACog,Tim Hortons,9106ffbcf50ad9c4787c9503b9ee7fbd,5,Amazing,a week ago,2024-02-10 14:03:09.592919,"Hi Vijaynath, thank you for the fantastic 5-star rating!   Your support means the world to us!",a week ago,2024-02-10 14:03:09.592919,0,1,,False,,
ChIJPxLbKTO35zsRFzyVYjIACog,Tim Hortons,1b59336313b4e7d0ba50a40a6360b403,5,Amazing experience,a week ago,2024-02-10 14:03:09.596920,"Hi Sajjan, your positive feedback brightens our day! Were looking forward to the pleasure of exceeding your expectations on your next visit.",a week ago,2024-02-10 14:03:09.596920,0,1,,False,,
ChIJPxLbKTO35zsRFzyVYjIACog,Tim Hortons,6dc45e5a4e51f766b964079245fce819,5,Best service,a week ago,2024-02-10 14:03:09.600887,"Hi Santosh, your happiness is our top priority! We appreciate your support and are eager to impress you even more on your next visit.",a week ago,2024-02-10 14:03:09.600887,0,1,,False,,
ChIJPxLbKTO35zsRFzyVYjIACog,Tim Hortons,0ab345ffa56485d037c206d65eca8233,5,Best place,a week ago,2024-02-10 14:03:09.604919,"Hi Shyam, your positive feedback brightens our day! Were looking forward to the pleasure of exceeding your expectations on your next visit.",a week ago,2024-02-10 14:03:09.604919,0,2,,False,,
ChIJPxLbKTO35zsRFzyVYjIACog,Tim Hortons,5512110a277e319774f7db5ace6bc8b5,5,Great place,a week ago,2024-02-10 14:03:09.608919,"Hi Harish, your satisfaction is our mission. Were excited to welcome you back for another remarkable visit.",a week ago,2024-02-10 14:03:09.608919,0,1,6,False,,
ChIJPxLbKTO35zsRFzyVYjIACog,Tim Hortons,fa5031662a43c7bd8171ca28cb252815,5,Awesome place to visit,a week ago,2024-02-10 14:03:09.612920,"Hi Rahman, were thrilled by your positive feedback! Your support means the world to us, and we cant wait to welcome you back for an even more delightful experience.",a week ago,2024-02-10 14:03:09.612920,0,1,,False,,
ChIJPxLbKTO35zsRFzyVYjIACog,Tim Hortons,a8d9eb46b857d6dfe4cb83d2b5a84f63,5,best best Vegetarian options: Best option,a week ago,2024-02-10 14:03:09.616919,"Hi Aslam, thanks a lot for your rating! We cant wait to welcome you back for another fantastic experience. Until then, take care!",a week ago,2024-02-10 14:03:09.616919,0,1,,False,,
ChIJPxLbKTO35zsRFzyVYjIACog,Tim Hortons,01d2108b744435d52a59bbf5e902dcc2,5,Amazing . My all time favourite,a week ago,2024-02-10 14:03:10.526165,"Hi Simmer, a million thanks for your rating! Were overjoyed that you had a great time during your visit. We cant wait to see you again soon for more delightful coffee experiences!",a week ago,2024-02-10 14:03:10.526165,0,10,,False,,
ChIJPxLbKTO35zsRFzyVYjIACog,Tim Hortons,c59ea3b4a96adfe2e94d1097de39965f,5,Had a wonderful time,a week ago,2024-02-10 14:03:10.530165,"Hi Salim, your satisfaction is our mission. Were excited to welcome you back for another remarkable visit.",a week ago,2024-02-10 14:03:10.530165,0,1,,False,,
ChIJPxLbKTO35zsRFzyVYjIACog,Tim Hortons,6ae7c6bb07f21715f792d28925f70cf0,5,Amazing experience!!!,a week ago,2024-02-10 14:03:10.534164,"Hi Surendra, youve made our day with your 5-star rating! Were committed to maintaining this level of excellence for your next visit. See you again soon for more memorable moments!",a week ago,2024-02-10 14:03:10.534164,0,1,,False,,
ChIJPxLbKTO35zsRFzyVYjIACog,Tim Hortons,5af406843367d9532595eaecbbeb29a4,5,Good coffee and service was prompt,a week ago,2024-02-10 14:03:10.538164,"Hi Junad, thanks a lot for your rating! We cant wait to welcome you back for another fantastic experience. Until then, take care!",a week ago,2024-02-10 14:03:10.538164,0,2,,False,,
ChIJPxLbKTO35zsRFzyVYjIACog,Tim Hortons,b7e0ff169785bedb201ccc898dc21107,5,Nice place to hang out,a week ago,2024-02-10 14:03:10.542164,"Hi Jitendra, a million thanks for your rating! Were overjoyed that you had a great time during your visit. We cant wait to see you again soon for more delightful coffee experiences!",a week ago,2024-02-10 14:03:10.542164,0,1,,False,,
ChIJPxLbKTO35zsRFzyVYjIACog,Tim Hortons,283b17dadc3c5061bd9df541453d2931,5,Wonderful experience at Tim hortons Lokhandwala,a week ago,2024-02-10 14:03:10.546164,"Hi Suresh, thanks a lot for your rating! We cant wait to welcome you back for another fantastic experience. Until then, take care!",a week ago,2024-02-10 14:03:10.546164,0,1,,False,,
ChIJPxLbKTO35zsRFzyVYjIACog,Tim Hortons,d38facf99766491cb22fc5572b429270,5,Nice food and good staff...,a week ago,2024-02-10 14:03:10.550165,"Hi Suman, your satisfaction is our mission. Were excited to welcome you back for another remarkable visit.",a week ago,2024-02-10 14:03:10.550165,0,1,,False,,
ChIJPxLbKTO35zsRFzyVYjIACog,Tim Hortons,87e5cc99351c7d97b6ac6f691917c890,5,Thank you Tim Hortons for amazing service!!,a week ago,2024-02-10 14:03:10.555213,"Hi Ranjeet, your thoughtful remarks truly brightened our day! We cant wait to welcome you back for another delightful coffee experience. Until then, savor your coffee and keep spreading the joy!",a week ago,2024-02-10 14:03:10.555213,0,1,6,False,,
ChIJPxLbKTO35zsRFzyVYjIACog,Tim Hortons,f053a7d96889e1675d6922432b5e3ae8,5,Nice food and amazing coffee,a week ago,2024-02-10 14:03:10.560185,"Hi Rajesh, a million thanks for your fantastic 5-star rating!   Your support brightens our day!",a week ago,2024-02-10 14:03:10.560185,0,2,,False,,
ChIJPxLbKTO35zsRFzyVYjIACog,Tim Hortons,cef4b34c9557246368380e366cfd8303,5,Good coffee,a week ago,2024-02-10 14:03:10.564185,"Hi Uday, were thrilled to have your support! Looking forward to surpassing your expectations during your next visit.",a week ago,2024-02-10 14:03:10.564185,0,3,,False,,
ChIJPxLbKTO35zsRFzyVYjIACog,Tim Hortons,c6050488edf8fd67f728d562510610ca,5,Friendly staff and amazing coffee!!,a week ago,2024-02-10 14:03:11.586375,"Hi Ashish, your happiness is our top priority! We appreciate your support and are eager to impress you even more on your next visit.",a week ago,2024-02-10 14:03:11.586375,0,2,2,False,,
ChIJPxLbKTO35zsRFzyVYjIACog,Tim Hortons,218e518742e4db1374e75fff5c7f0f76,5,Good food and service... Staff was very friendly,a week ago,2024-02-10 14:03:11.590369,"Hi Ajaz, ensuring your satisfaction is our top priority! We cant wait to have you back for another exceptional experience.",a week ago,2024-02-10 14:03:11.590369,0,1,,False,,
ChIJPxLbKTO35zsRFzyVYjIACog,Tim Hortons,011d027684ba9101d6fa5e7192832199,1,No vegan options. Staff has no idea what dairy free options are available.,a week ago,2024-02-10 14:03:11.593367,"Hey Monica, were sorry for any inconvenience you may have faced. To assist you better, please send your contact number to telltims@timhortonsindia.com along with your feedback. Our team is dedicated to ensuring you have a fantastic experience with us!",a week ago,2024-02-10 14:03:11.593367,0,3,,False,,
ChIJPxLbKTO35zsRFzyVYjIACog,Tim Hortons,1367800ad8bea02c3b27e752df2a87f0,5,,a week ago,2024-02-10 14:03:11.597369,"Hi Azhar, a huge virtual high-five for your 5-star rating! Your satisfaction is what drives our passion. We eagerly waiting for your return for yet another 5-star experience!",a week ago,2024-02-10 14:03:11.597369,0,,,,,
ChIJPxLbKTO35zsRFzyVYjIACog,Tim Hortons,28ec933636e568b2ef31240d584a2a75,5,,a week ago,2024-02-10 14:03:11.601369,"Hi Altaf, a million thanks for your 5-star rating!",a week ago,2024-02-10 14:03:11.601369,0,2,5,False,,
ChIJPxLbKTO35zsRFzyVYjIACog,Tim Hortons,d7ff949d2cce1ebc306e63feadcc33e9,5,,a week ago,2024-02-10 14:03:11.604369,"Hi Imran, a million thanks for your fantastic 5-star rating!   Your support brightens our day!",a week ago,2024-02-10 14:03:11.604369,0,,,,,
ChIJPxLbKTO35zsRFzyVYjIACog,Tim Hortons,cc48fc850658d159d2b34a862db6d05a,5,,a week ago,2024-02-10 14:03:11.608369,"Hi Shaikh, youve made our day with your 5-star rating! Were committed to maintaining this level of excellence for your next visit. See you again soon for more memorable moments!",a week ago,2024-02-10 14:03:11.608369,0,,,,,
ChIJPxLbKTO35zsRFzyVYjIACog,Tim Hortons,f0d65a8f8dd043bca7230d5cebf8ab7f,5,,a week ago,2024-02-10 14:03:11.612369,"Hi Ranjan, we appreciate your generous 5-star rating!",a week ago,2024-02-10 14:03:11.612369,0,3,,False,,
ChIJPxLbKTO35zsRFzyVYjIACog,Tim Hortons,485f48dd339f62e5025f10c7a8593acd,5,,a week ago,2024-02-10 14:03:11.615369,"Hey Iqbal, we appreciate your generous 5-star rating!",a week ago,2024-02-10 14:03:11.615369,0,,,,,
ChIJPxLbKTO35zsRFzyVYjIACog,Tim Hortons,db3bbf1be68070071f23bb06f04ff61c,5,,a week ago,2024-02-10 14:03:11.619369,"Hi Ajmeri, a million thanks for your fantastic 5-star rating!   Your support brightens our day!",a week ago,2024-02-10 14:03:11.619369,0,,,,,
ChIJPxLbKTO35zsRFzyVYjIACog,Tim Hortons,dd616cdab04e1a74db5e08bf9ae48283,5,,a week ago,2024-02-10 14:03:12.305986,"Hi Sam, a million thanks for your fantastic 5-star rating!   Your support brightens our day!",a week ago,2024-02-10 14:03:12.305986,0,1,,False,,
ChIJPxLbKTO35zsRFzyVYjIACog,Tim Hortons,420651439abf81cc1161f63085e863d4,5,,a week ago,2024-02-10 14:03:12.309982,"Hi Parth, a million thanks for your rating! Were overjoyed that you had a great time during your visit. We cant wait to see you again soon for more delightful coffee experiences!",a week ago,2024-02-10 14:03:12.309982,0,,,,,
ChIJPxLbKTO35zsRFzyVYjIACog,Tim Hortons,16734651c4130e08d6d90cbbf04bc6bd,5,Good food and ambieance was really nice!! Friendly customer service....Loved Tim hortons,a week ago,2024-02-10 14:03:12.312980,"Hey Sandeep, your happiness is our top priority! We appreciate your support and are eager to impress you even more on your next visit.",a week ago,2024-02-10 14:03:12.312980,0,2,,False,,
ChIJPxLbKTO35zsRFzyVYjIACog,Tim Hortons,9c78567a6aa7f0fc2344801bb919880b,5,,a week ago,2024-02-10 14:03:12.316982,"Hi Farhan, a million thanks for your fantastic 5-star rating!   Your support brightens our day!",a week ago,2024-02-10 14:03:12.316982,0,14,5,True,,
ChIJPxLbKTO35zsRFzyVYjIACog,Tim Hortons,5eefe941206a6a1e5fbbb1eca10c2f7c,5,Good service for Rishi,a week ago,2024-02-10 14:03:12.320982,"Hi Vinod, your happiness is our top priority! We appreciate your support and are eager to impress you even more on your next visit.",a week ago,2024-02-10 14:03:12.320982,0,1,,False,,
ChIJPxLbKTO35zsRFzyVYjIACog,Tim Hortons,e3ffa3b59e280b0f5aecbf3f8dbb2b6d,5,"Amazing staff and ambience, but should add more healthy food items and no sugar food items.",a week ago,2024-02-10 14:03:12.323981,"Hi Sanket, thanks for sharing your feedback. We have taken a note on your remarks & will make sure it reaches to the concerned team.",a week ago,2024-02-10 14:03:12.323981,0,6,,False,,
ChIJPxLbKTO35zsRFzyVYjIACog,Tim Hortons,441cdb554f7db0a23b0fa5b8c945174c,5,,a week ago,2024-02-10 14:03:12.327983,"Hi Vikas, a million thanks for your fantastic 5-star rating!   Your support brightens our day!",a week ago,2024-02-10 14:03:12.327983,0,3,,False,,
ChIJPxLbKTO35zsRFzyVYjIACog,Tim Hortons,b7095070244ef8319f3829b0d2765ab8,5,,a week ago,2024-02-10 14:03:12.331977,"Hey Raghunath, youve made our day with your 5-star rating! Were committed to maintaining this level of excellence for your next visit. See you again soon for more memorable moments!",a week ago,2024-02-10 14:03:12.331977,0,61,37,True,,
ChIJPxLbKTO35zsRFzyVYjIACog,Tim Hortons,ce7980568c2d9507a4de1418a6da9093,5,,a week ago,2024-02-10 14:03:12.335979,"Hi Yashwant, thank you for the fantastic 5-star rating!   Your support means the world to us!",a week ago,2024-02-10 14:03:12.335979,0,2,,False,,
ChIJPxLbKTO35zsRFzyVYjIACog,Tim Hortons,a19f4648c53c7b376fcaeb28826ac9e0,5,,a week ago,2024-02-10 14:03:12.338981,"Hi Dhwani, a huge virtual high-five for your 5-star rating! Your satisfaction is what drives our passion. We eagerly waiting for your return for yet another 5-star experience!",a week ago,2024-02-10 14:03:12.338981,0,5,37,True,,
ChIJPxLbKTO35zsRFzyVYjIACog,Tim Hortons,9e5d7379c1c025f4a35524182d0b8e83,5,,a week ago,2024-02-10 14:03:12.996681,"Hey Pragya, a perfect 5-star rating! Thank you for your unwavering support. Were dedicated to keeping up the great work to make every visit special for you.",a week ago,2024-02-10 14:03:12.996681,0,1,,False,,
ChIJPxLbKTO35zsRFzyVYjIACog,Tim Hortons,48b8d9d15fe98c091d4081bf081b1291,5,,a week ago,2024-02-10 14:03:12.999681,"Hey Toshani, youve made our day with your 5-star rating! Were committed to maintaining this level of excellence for your next visit. See you again soon for more memorable moments!",a week ago,2024-02-10 14:03:12.999681,0,3,,False,,
ChIJPxLbKTO35zsRFzyVYjIACog,Tim Hortons,19ce91ecdcae1736fa07d7f1932b7fe9,4,,a week ago,2024-02-10 14:03:13.003681,Hi Najim! were thrilled to see your rating. It means a lot to us. Looking forward to serving you again soon!,a week ago,2024-02-10 14:03:13.003681,0,,,,,
