place_id,place_name,review_id_hash,rating,review_text,published_at,published_at_date,response_from_owner_text,response_from_owner_ago,response_from_owner_date,review_likes_count,total_number_of_reviews_by_reviewer,total_number_of_photos_by_reviewer,is_local_guide,review_translated_text,response_from_owner_translated_text
ChIJPxLbKTO35zsRFzyVYjIACog,Tim Hortons,1a39382dbb62833e2b503600281870a7,3,"Aarons Final Rating is 3.5 Visted this place many times. The location is nice and crowd here is classy too. You will get to see lot of rich and snobbish people, so brace yourself. Lot of struggles visiting this place too. There is crowd always but its huge. The staff is great too. Must Trys :- - Caramel Macchiato - Cappacino - Cafe Latte Must Avoid :- Sitting close to the footpath area. There is water stagnation, so lot mosquitoes breeding. You may not realise it first, but after an hour you will be scratching yourself with big bites on your body. Tim Hortons Lokhandwala - Please inform this to your management. Full Ratings:- Location : 3.5 Ambience : 4 Staff : 4 Food Quality : 4 Food Quantity : 4 Price:     (Expensive) All in all, a good place. Check out the pictures and videos. If you liked my review, do like it.",4 months ago,2023-10-17 14:03:33.521524,"Hey Aaron, Thanks for sharing your remarks and we appreciate your feedback. Rest assured, your comments will be directed to the relevant team.  If theres anything specific youd like to address or share, please write to us at telltims@timhortonsindia.com. Your satisfaction is our priority, and were here to assist with any concerns you may have.",4 months ago,2023-10-17 14:03:33.521524,0,79,496,True,,
ChIJPxLbKTO35zsRFzyVYjIACog,Tim Hortons,cf57cc210369493a3e74e30f5ee739e1,5,Great coffee and super ambience. Fast service too. Overall good place. Food,4 months ago,2023-10-17 14:03:33.525526,Hello Vikram! your remarks put a smile on our faces. Were excited to have the opportunity to serve you again soon. Cheers to more wonderful moments together!,4 months ago,2023-10-17 14:03:33.525526,0,9,1,True,,
ChIJPxLbKTO35zsRFzyVYjIACog,Tim Hortons,b5493e2bc74ea10ce507026679bf4033,5,,4 months ago,2023-10-17 14:03:33.530523,"Hey Sandeep, were over the moon. Thank you for your support, and we look forward to exceeding your expectations on your next visit!",4 months ago,2023-10-17 14:03:33.530523,0,43,18,True,,
ChIJPxLbKTO35zsRFzyVYjIACog,Tim Hortons,0fed34acceab8026ac323057d4b172e4,5,Just visit and enjoy the deliciousness of Meal & beverages. Credit goes to Tims team Food : 4/5,4 months ago,2023-10-17 14:03:33.537525,"Hello Dhiraj, your satisfaction is our mission. Were excited to welcome you back for another remarkable visit.",4 months ago,2023-10-17 14:03:33.537525,0,16,,True,,
ChIJPxLbKTO35zsRFzyVYjIACog,Tim Hortons,f8d62d10e1fae97635c95d5d861a4956,5,This review is for Mr.Farhan Thank you for you sweet gesture for sending over a Famous Donut. And thankyou to the team for always making my coffee just how I like it. Food : 5/5,4 months ago,2023-10-17 14:03:33.544526,"Hey there, were over the moon. Thank you for your support, and we look forward to exceeding your expectations on your next visit!",4 months ago,2023-10-17 14:03:33.544526,0,3,,False,,
ChIJPxLbKTO35zsRFzyVYjIACog,Tim Hortons,cc9daafbd2f3ac8f8592d886e3f65e31,4,,4 months ago,2023-10-17 14:03:34.504507,"Hi Vrushali, thank you for leaving us a rating! Hoping to serve you again in the future.",4 months ago,2023-10-17 14:03:34.504507,0,5,37,True,,
ChIJPxLbKTO35zsRFzyVYjIACog,Tim Hortons,6b88344987787040ce71b08d0a2007da,3,,4 months ago,2023-10-17 14:03:34.507502,"Hi Harshil, Your feedback is valuable to us! To better understand your concerns, kindly share your contact number and store location details at telltims@timhortonsindia.com, along with your feedback. Were committed to making things right for you!",4 months ago,2023-10-17 14:03:34.507502,0,10,14,True,,
ChIJPxLbKTO35zsRFzyVYjIACog,Tim Hortons,5a40f65285a4fed3f23b2bc834c0d401,4,,4 months ago,2023-10-17 14:03:34.511506,"Hi Harshal, Were thrilled to see your rating. It means a lot to us. Looking forward to serving you again soon!",4 months ago,2023-10-17 14:03:34.511506,0,94,433,True,,
ChIJPxLbKTO35zsRFzyVYjIACog,Tim Hortons,01ffa6a8c04edd728aa8a805d6f6f008,4,,4 months ago,2023-10-17 14:03:34.514506,"Hi Mayur, Were thrilled to see your rating. It means a lot to us. Looking forward to serving you again soon!",4 months ago,2023-10-17 14:03:34.514506,0,15,6,False,,
ChIJPxLbKTO35zsRFzyVYjIACog,Tim Hortons,d6ca216d8741f162d327fe1dc06228b0,3,,4 months ago,2023-10-17 14:03:34.518506,"Hello, were interested in learning more about the reasons behind your low rating. Please provide your contact number and the location of the store at telltims@timhortonsindia.com, along with your feedback. Our team will contact you to address your concerns further.",4 months ago,2023-10-17 14:03:34.518506,0,33,12,True,,
ChIJPxLbKTO35zsRFzyVYjIACog,Tim Hortons,d29f5d4a59dd2ab8749f8759a4547810,5,,4 months ago,2023-10-17 14:03:34.521506,"Hello Kusshal, we appreciate your generous 5-star rating!",4 months ago,2023-10-17 14:03:34.521506,0,37,,True,,
ChIJPxLbKTO35zsRFzyVYjIACog,Tim Hortons,27e18d668e0adfa64a245b43a294c8b8,3,,4 months ago,2023-10-17 14:03:34.524503,"Hey Sonal, we regret your recent experience with us. Your feedback will be shared with the relevant team. In case of any concern, please write to us at telltims@timhortonsindia.com and we will look into it.",4 months ago,2023-10-17 14:03:34.524503,0,4,10,True,,
ChIJPxLbKTO35zsRFzyVYjIACog,Tim Hortons,b2bf5c7cf14f1897fd728e7fb27bc4fc,4,,4 months ago,2023-10-17 14:03:34.528506,"Hey Jai, thanks a lot for your rating! We cant wait to welcome you back for another fantastic experience. Until then, take care!",4 months ago,2023-10-17 14:03:34.528506,0,,,,,
ChIJPxLbKTO35zsRFzyVYjIACog,Tim Hortons,8f01608632b3cc45ae6918ea895aed9b,3,They are not efficient when it comes to giving customers clean tables. You have to tell the staff and even then sometimes nobody comes to clear your table. Customer service needs to be improved.,4 months ago,2023-10-17 14:03:34.531510,"Hi Krishna, were sorry for any inconvenience you may have faced. To assist you better, please send your contact number and store location details to telltims@timhortonsindia.com along with your feedback. Our team is dedicated to ensuring you have a fantastic experience with us!",4 months ago,2023-10-17 14:03:34.531510,0,7,,False,,
ChIJPxLbKTO35zsRFzyVYjIACog,Tim Hortons,bf3171cbdfbb55d2bf211f51bd871e56,3,"Great service! Shivam my server was great. Nice place to do your work,have a meeting or meet a friend but the coffee is not the best,the food options are limited cause they go out of stock very often. BUT THE SERVICE WAS AMAZING - I did not like the taste of their Java chip coffee because it had no coffee so I told Shivam, my server and he was a gem,he made sure I got my coffee the way I like it. Thanks Shivam! I ve had better coffee at starbucks, the vanilla bean coffee was damn tasty and the almond croissant was good too but the java chip is made with no coffee and the tim bits were below average.",5 months ago,2023-09-17 14:03:34.535509,"Hi Mahima, we appreciate your feedback. To address your concerns and enhance your experience, please send your contact number and store location details to telltims@timhortonsindia.com along with your feedback. Were here to make it right!",5 months ago,2023-09-17 14:03:34.535509,1,86,233,True,,
ChIJPxLbKTO35zsRFzyVYjIACog,Tim Hortons,0240a41b54500820c0fd2944b8c3136a,1,,5 months ago,2023-09-17 14:03:35.471621,"Hello, were interested in learning more about the reasons behind your low rating. Please provide your contact number and the location of the store at telltims@timhortonsindia.com, along with your feedback. Our team will contact you to address your concerns further.",5 months ago,2023-09-17 14:03:35.471621,0,1,,False,,
ChIJPxLbKTO35zsRFzyVYjIACog,Tim Hortons,b257960d6a4402a310e89a8f7fa7f8f9,1,"Force fit Canada theming, local cafes give much better coffee (taste, customisations) & food options (fresh and not frozen like Tim Hortons) wanted to have a cold beverage but ultimately Tried a cappuccino (254 INR) coz every cold beverage had a powder thickener.",5 months ago,2023-09-17 14:03:35.474621,"Hey Vishad, were sorry to hear about your experience. Please provide us with your contact number and store location details at telltims@timhortonsindia.com, along with your feedback. Our team is here to ensure your next visit is exceptional!",5 months ago,2023-09-17 14:03:35.474621,0,24,6,True,,
ChIJPxLbKTO35zsRFzyVYjIACog,Tim Hortons,4842506786712f3ae52f9ef894b4ac60,5,Its a lovely place and overall I loved the coffee here. Nice sitting area for both smokers and Non smokers. Good food options available. I had Americano as usual which wasnt that extra ordinary but the cold coffee was good. Cup size is bigger so be careful while ordering as a medium size coffee here is generally large at other places.,5 months ago,2023-09-17 14:03:35.478621,"Hi Binit, Your remarks motivate us to continue delivering top-notch experiences. We cant wait to serve you again soon.",5 months ago,2023-09-17 14:03:35.478621,0,148,176,True,,
ChIJPxLbKTO35zsRFzyVYjIACog,Tim Hortons,4a468d47251f3a5626c138446351e133,1,"Limited inside space, and you can t sit outside as homeless people stand there asking for food. The food is a disappointment, cheesecake and the pastries were hard as a rock, and the 5 cheese sandwich bread was so hard to chew that I had to leave it. Edit: Reply To Tim Hortons customer care, who requested for location details, I have already tagged the review to the specific location only. I think mu feedback has already been provided so I don t need to provide my phone number. Thank you.",5 months ago,2023-09-17 14:03:35.482622,"Hi Gagandeep, were sorry for any inconvenience you may have faced. To assist you better, please send your contact number and store location details to telltims@timhortonsindia.com along with your feedback. Our team is dedicated to ensuring you have a fantastic experience with us!",5 months ago,2023-09-17 14:03:35.482622,0,122,584,True,,
ChIJPxLbKTO35zsRFzyVYjIACog,Tim Hortons,51002991ec63d0e025215bf0b139547c,5,Love the variety of food options! Decent quantity and great taste. Coffee was a little too sweet. But very cute little hangout spot!,5 months ago,2023-09-17 14:03:35.485621,"Hi Tanisha, your satisfaction is our mission & we appreciate your feedback. Thank you for your support, and we look forward to exceeding your expectations on your next visit!",5 months ago,2023-09-17 14:03:35.485621,0,70,107,True,,
ChIJPxLbKTO35zsRFzyVYjIACog,Tim Hortons,c4d11a5d3bf79902091a45b0f3839a28,3,,5 months ago,2023-09-17 14:03:35.489621,"Hey Monica, we regret your recent experience with us. Your feedback will be shared with the relevant team. In case of any concern, please write to us at telltims@timhortonsindia.com and we will look into it.",5 months ago,2023-09-17 14:03:35.489621,0,14,4,False,,
ChIJPxLbKTO35zsRFzyVYjIACog,Tim Hortons,5e3944d501d414c8666194fbd016f580,3,The cafe is ok ok...not as expected. Price wise is expensive as compared to qty.,5 months ago,2023-09-17 14:03:35.492621,"Hi Kanchan, were disappointed that your recent experience fell short of expectations, and we appreciate your feedback. Rest assured, your comments will be directed to the relevant team. If theres anything specific youd like to address or share, please write to us at telltims@timhortonsindia.com. Your satisfaction is our priority, and were here to assist with any concerns you may have.",5 months ago,2023-09-17 14:03:35.492621,0,24,75,True,,
ChIJPxLbKTO35zsRFzyVYjIACog,Tim Hortons,cdeb02a2d0c52c329b74e1ee9894ae1f,3,,5 months ago,2023-09-17 14:03:35.497621,"Hi Aqib, we regret your recent experience with us. Your feedback will be shared with the relevant team. In case of any concern, please write to us at telltims@timhortonsindia.com and we will look into it.",5 months ago,2023-09-17 14:03:35.497621,0,4,,True,,
ChIJPxLbKTO35zsRFzyVYjIACog,Tim Hortons,ad2a3014ec80e1a6d07057f2a44d6ccb,5,,5 months ago,2023-09-17 14:03:35.500621,"Hi Aaishwarya, we appreciate your generous 5-star rating!",5 months ago,2023-09-17 14:03:35.500621,0,2,,False,,
ChIJPxLbKTO35zsRFzyVYjIACog,Tim Hortons,61562a87cc2ae5171f0dcc05e1dfecb0,5,,5 months ago,2023-09-17 14:03:35.503621,"Hi Satish, we appreciate your generous 5-star rating!",5 months ago,2023-09-17 14:03:35.503621,0,22,,False,,
ChIJPxLbKTO35zsRFzyVYjIACog,Tim Hortons,dd98dac2e85aaac123c533399d742ae3,5,"Had a bitter sweet experience today at Tim Hortons. Ordered an Americano and cream cheese bagel. Due to some reason the food was cold and stale. We explained our problem to the staff. The staff not only solved the problem but they apologized sincerely and packed us an extra hot Americano and two donuts, complementary. It was very surprising as most of the coffee shops dont even apologize properly. Cudos to the staff for understanding the customers problem and politely solving it. The staff must get a raise for this. This five star rating is all for the staff. They have kept the name of the coffee shop    .",5 months ago,2023-09-17 14:03:36.252906,"Hi Savita, we regret to hear about your recent experience, and we appreciate your feedback. Furthermore, we assure you that you will not encounter this type of issue in the future.",5 months ago,2023-09-17 14:03:36.252906,1,4,,False,,
ChIJPxLbKTO35zsRFzyVYjIACog,Tim Hortons,7391afa49f302b596eed9e63464640fa,5,,5 months ago,2023-09-17 14:03:36.256935,"Hi Rishi, thanks a lot for your rating! We cant wait to welcome you back for another fantastic experience. Until then, take care!",5 months ago,2023-09-17 14:03:36.256935,0,21,37,True,,
ChIJPxLbKTO35zsRFzyVYjIACog,Tim Hortons,c2cdf31ed2c1431f6376bff9c6bbca45,1,"I ordered 2 iced latte yesterday, it was unsweetened and tasted horrible, nowhere it was mentioned that it would be without sugar, besides the latte was too watery. Quite disappointed. Will stick to Starbucks",5 months ago,2023-09-17 14:03:36.260953,"Hi Aparna, were sorry for any inconvenience you may have faced. To assist you better, please send your contact number and store location details to telltims@timhortonsindia.com along with your feedback. Our team is dedicated to ensuring you have a fantastic experience with us!",5 months ago,2023-09-17 14:03:36.260953,0,34,55,True,,
ChIJPxLbKTO35zsRFzyVYjIACog,Tim Hortons,f636fef8cab5a7aa8eda3fd09a80adf6,4,,5 months ago,2023-09-17 14:03:36.263937,Hi Prithvi! were thrilled to see your rating. It means a lot to us. Looking forward to serving you again soon!,5 months ago,2023-09-17 14:03:36.263937,0,188,2235,True,,
ChIJPxLbKTO35zsRFzyVYjIACog,Tim Hortons,ebf07100336b2d5a47e7ed3d00db4367,5,,5 months ago,2023-09-17 14:03:36.267940,"Hi Sana, a big high-five for your 5-star rating! Your satisfaction fuels our passion. Cant wait to welcome you back for another 5-star experience!",5 months ago,2023-09-17 14:03:36.267940,0,53,14,True,,
ChIJPxLbKTO35zsRFzyVYjIACog,Tim Hortons,6b7dc1e52e65219c40e856d72f3f8b8e,4,,5 months ago,2023-09-17 14:03:36.270939,"Hi Harminder, were thrilled to see your rating. It means a lot to us. Looking forward to serving you again soon!",5 months ago,2023-09-17 14:03:36.270939,0,22,,True,,
ChIJPxLbKTO35zsRFzyVYjIACog,Tim Hortons,bdfb359ab292ebcfa3093bb04ee2b518,3,"Tastewise, Its average. Just hyped.",5 months ago,2023-09-17 14:03:36.273937,"Hi Amrit, we regret your recent experience with us. Your feedback will be shared with the relevant team. In case of any concern, please write to us at telltims@timhortonsindia.com and we will look into it.",5 months ago,2023-09-17 14:03:36.273937,0,25,,False,,
ChIJPxLbKTO35zsRFzyVYjIACog,Tim Hortons,1401b8696f89037c1759d45ed09bd011,5,,5 months ago,2023-09-17 14:03:36.276938,"Hi Siddharth, your rating motivates us to continue delivering top-notch experiences. We cant wait to serve you again soon.",5 months ago,2023-09-17 14:03:36.276938,0,2,5,False,,
ChIJPxLbKTO35zsRFzyVYjIACog,Tim Hortons,91b3b8088256aeb16c867279ad608878,1,,5 months ago,2023-09-17 14:03:36.280938,"Hi Vishal, wed like to understand the reason for rating us low. Please drop in your contact number and store location details at telltims@timhortonsindia.com along with your feedback, and our team will reach out to address it further.",5 months ago,2023-09-17 14:03:36.280938,0,10,6,False,,
ChIJPxLbKTO35zsRFzyVYjIACog,Tim Hortons,81b9db4fe9af547d45cdaf411ddfaf8e,4,,5 months ago,2023-09-17 14:03:36.283940,"Hi Dheer, were thrilled to see your rating. It means a lot to us. Looking forward to serving you again soon!",5 months ago,2023-09-17 14:03:36.283940,0,45,,True,,
ChIJPxLbKTO35zsRFzyVYjIACog,Tim Hortons,b4fbaa41e5dd09ce24c77069c54002e6,5,,5 months ago,2023-09-17 14:03:36.995009,"Hi Karishmaa, your 5-star rating is like music to our ears! Were excited to continue delivering exceptional moments during your future visits. Thank you!",5 months ago,2023-09-17 14:03:36.995009,0,29,3,True,,
ChIJPxLbKTO35zsRFzyVYjIACog,Tim Hortons,b00b68d472b98aaea589801e7e2157b9,3,Items on the menu were unavailable even during prime business hours. Food is simple and delicious,5 months ago,2023-09-17 14:03:36.999008,"Hello Siddhesh, We appreciate your feedback. To address your concerns and enhance your experience, please send your contact number and store location details to telltims@timhortonsindia.com along with your feedback. Were here to make it right!",5 months ago,2023-09-17 14:03:36.999008,0,147,218,True,,
ChIJPxLbKTO35zsRFzyVYjIACog,Tim Hortons,e67485c9b6de36e7c44e331a016177b3,3,"Limited interior seating. Outside is full of flies. Staff are nice but crippled by poor systems so they take ages to get your order. And last I was there, their coffee grinder wasnt working. Wait. What???",5 months ago,2023-09-17 14:03:37.004010,"Hi Sam, Were sorry to hear about your experience. Please provide us with your contact number and store location details at telltims@timhortonsindia.com, along with your feedback. Our team is here to ensure your next visit is exceptional!",5 months ago,2023-09-17 14:03:37.004010,0,103,52,True,,
ChIJPxLbKTO35zsRFzyVYjIACog,Tim Hortons,02b1839142592e4970847d85b1ea904b,4,"Tim Hortons - Stepped in for a French Vanilla Black and a chocolate pastry, both of which knocked it out of the park. Seriously, that pastry could write a memoir about how awesome it is, and Id read it. But lets talk wait times oh, the wait times. I had enough time to ponder the existential crises of my life while waiting for that cup of joe. Its as if each coffee bean is being individually interviewed before making it into the grinder. And our baristas? Bless their hearts, they could use a training montage. Think Rocky, but with espresso machines instead of punching bags. Still, despite the time warp and the barista learning curve, the coffee and pastry did not disappoint. They were the saving grace, like finding a Rs 500 bill in an old pair of jeans. Id give it a solid 7 out of 10. Why? Because the flavors were the heroes of this story, swooping in to save the day, while everything else was, lets say, a work in progress. Would I go back? Absolutely, but Ill bring War and Peace to read while I wait.",5 months ago,2023-09-17 14:03:37.007011,Hey Javed! Thanks for the valuable remarks. Your feedback has been noted & will make sure it reaches the concerned team.,5 months ago,2023-09-17 14:03:37.007011,0,80,164,True,,
ChIJPxLbKTO35zsRFzyVYjIACog,Tim Hortons,dcbb0da6500053ecfe252aee6ace3964,5,,5 months ago,2023-09-17 14:03:37.010997,"Hi Nehal, We appreciate your generous 5-star rating!",5 months ago,2023-09-17 14:03:37.010997,0,26,51,True,,
ChIJPxLbKTO35zsRFzyVYjIACog,Tim Hortons,5b06f6ae90a289e9186afed3d6aa6e51,5,,5 months ago,2023-09-17 14:03:37.014007,"Hi Shubham, We appreciate your generous 5-star rating!",5 months ago,2023-09-17 14:03:37.014007,0,40,298,True,,
ChIJPxLbKTO35zsRFzyVYjIACog,Tim Hortons,ffcc1e8c59a1dd4b14e0365f51172581,5,Excellent food and good service,5 months ago,2023-09-17 14:03:37.018009,"Hi shraddha, A big high-five for your 5-star rating! Your satisfaction fuels our passion. Cant wait to welcome you back for another 5-star experience!",5 months ago,2023-09-17 14:03:37.018009,0,2,,False,,
ChIJPxLbKTO35zsRFzyVYjIACog,Tim Hortons,e8195e6c1bcf9c4aa4931eba2a7a09a9,5,,5 months ago,2023-09-17 14:03:37.022009,"Thank you for the amazing 5, Jaspreet Singh! Looking forward to your next visit.",5 months ago,2023-09-17 14:03:37.022009,0,1,5,False,,
ChIJPxLbKTO35zsRFzyVYjIACog,Tim Hortons,7f59d2517862da661f8605e2e3c9fc2c,1,"The Food is yet to match up the quality to the original.The boys (Floor Manager) did their best to work upto it. Service was good Atmosphere needs a big change,hold on to the seats before they change places. AG group some ground work needed to be done in this outlet.(Lokhandwala)",5 months ago,2023-09-17 14:03:37.023983,"Hi Noel, Were committed to making your experience better. If you could share your contact number and store location details at telltims@timhortonsindia.com along with your feedback, our team will get in touch to resolve any concerns you have. Thanks for helping us improve!",5 months ago,2023-09-17 14:03:37.023983,0,58,,True,,
ChIJPxLbKTO35zsRFzyVYjIACog,Tim Hortons,ed188fe184cf871ef1026a9aefebb66d,5,,5 months ago,2023-09-17 14:03:37.028010,"Thank you for the 5-star rating, Dharmishtha Dagia (Dharmishtha Dagia)! Do visit us again soon.",5 months ago,2023-09-17 14:03:37.028010,0,17,10,True,,
ChIJPxLbKTO35zsRFzyVYjIACog,Tim Hortons,1e9348ceec3625597585314456404f8c,2,,5 months ago,2023-09-17 14:03:37.821314,"Hi Shalini Aggarwal, wed like to understand the reason for rating us low. Please drop in your contact details at telltims@timhortonsindia.com along with your feedback, and our team will reach out to address it further.",5 months ago,2023-09-17 14:03:37.821314,0,43,3,True,,
ChIJPxLbKTO35zsRFzyVYjIACog,Tim Hortons,9d6390c0fa164f96d8af42775a7a452e,3,The place is understaffed and undertrained. The pick up point was over crowded. The buzzer doesnt work so you are standing and guessing. They ran out of stuff fast and the staff said they were available without checking. One staff particularly in their bandra branch was really rude. Please can you train staff more to do faster billing and help with calling out orders efficiently,5 months ago,2023-09-17 14:03:37.825307,"Hey, we regret your recent experience with us. Your feedback will be shared with the relevant team. In case of any concern, please write to us at telltims@timhortonsindia.com and we will look into it.",5 months ago,2023-09-17 14:03:37.825307,0,4,,False,,
ChIJPxLbKTO35zsRFzyVYjIACog,Tim Hortons,836d805b8fd8c2dce1b7f8b8addf4e10,5,,5 months ago,2023-09-17 14:03:37.828306,"Hey Vinay, Thank you for the 5-star rating",5 months ago,2023-09-17 14:03:37.828306,0,6,,False,,
ChIJPxLbKTO35zsRFzyVYjIACog,Tim Hortons,ab5a2eba9c3e163143c66d6558848b8b,3,Kids friendly place.. variety available in food and coffee,5 months ago,2023-09-17 14:03:37.831307,"Hi Alisha, Thank you for leaving us a rating! Hoping to serve you again in the future.",5 months ago,2023-09-17 14:03:37.831307,0,54,221,True,,
ChIJPxLbKTO35zsRFzyVYjIACog,Tim Hortons,09217a859433c445a89f1efb3211e028,4,Good food,5 months ago,2023-09-17 14:03:37.834307,"Hi Vinay, Thank you for leaving us a rating! Hoping to serve you again in the future.",5 months ago,2023-09-17 14:03:37.834307,0,39,,False,,
ChIJPxLbKTO35zsRFzyVYjIACog,Tim Hortons,aa0a7aa2a1f9f5e1e4a10064566a3c16,5,,5 months ago,2023-09-17 14:03:37.838307,"Hey Imran, Thank you for the 5-star rating",5 months ago,2023-09-17 14:03:37.838307,0,54,46,True,,
ChIJPxLbKTO35zsRFzyVYjIACog,Tim Hortons,f93b13ee3f1320fd71792b153f86cca8,5,Wish they would offer more sugar free options,5 months ago,2023-09-17 14:03:37.841314,"Hey! We appreciate your suggestion, and we will ensure that your comments are passed along to the appropriate team for consideration.",5 months ago,2023-09-17 14:03:37.841314,0,7,,False,,
ChIJPxLbKTO35zsRFzyVYjIACog,Tim Hortons,ca133e0b9ff3aec866a69817a5b0b7c9,4,,5 months ago,2023-09-17 14:03:37.845306,"Thank you for rating us, Swapnil Fadnis! Looking forward to your next visit.",5 months ago,2023-09-17 14:03:37.845306,0,7,,True,,
ChIJPxLbKTO35zsRFzyVYjIACog,Tim Hortons,0054afb1cb71bcf4dc71f277226d3a6f,5,,5 months ago,2023-09-17 14:03:37.848309,"Thank you for the 5-star rating, Dhaval Chandarana! Looking forward to your next visit.",5 months ago,2023-09-17 14:03:37.848309,0,59,4,True,,
ChIJPxLbKTO35zsRFzyVYjIACog,Tim Hortons,0873be839ba91049802f195153762dc8,5,,5 months ago,2023-09-17 14:03:37.852306,"Thank you for the perfect 5,Dhanya Menon! Do visit us again soon.",5 months ago,2023-09-17 14:03:37.852306,0,41,29,True,,
ChIJPxLbKTO35zsRFzyVYjIACog,Tim Hortons,5588c14170e2cf35f79c719b69b60db3,4,Service needs to improve.,5 months ago,2023-09-17 14:03:38.616787,"Hello, your feedback is valuable is to us and we have duly made a note of it. Looking forward to providing you with a much better experience next time.",5 months ago,2023-09-17 14:03:38.616787,0,271,19,True,,
